User,4,8,TRUE,0,TomZ.,HORRIBLE FILM!! so boring, this metascore is clearly rigged, it is impossible for 100, as that means absolutely everyone rated it perfect! Grrr.,,,,,,,,,,,,,,,,,,,,,,,,,,,,,,,,,,,,,,,,
User,4,8,TRUE,3,NickP,Too overrated.either the the revievers were paid to give it good scores or they were threatened by the mob.,,,,,,,,,,,,,,,,,,,,,,,,,,,,,,,,,,,,,,,,,,,
User,1,2,TRUE,5,PatR,It's funny. I just read Zach B's comment. And guess what buddy? I was born in 1994. So take that. Anyway, I thought this movie was okay. I'm sure it was good at the time, but should it really be considered the greatest film of It's funny. I just read Zach B's comment. And guess what buddy? I was born in 1994. So take that. Anyway, I thought this movie was okay. I'm sure it was good at the time, but should it really be considered the greatest film of all time? Films like Die Hard were good at the time, and are STILL good today, and yet no one considers THAT the greatest movie of all time. Godfather, in general, seems very tame compared to many modern films such as Changeling. I can understand why adults think it's the greatest film of all time, but it just isn't my cup of tea. I never did like classic films unless they have something good in them other then the fact that they're classic.,,,,,,,,,,,,,,,,,,,,,,,,,,,,,,,,,,
User,1,2,FALSE,4,AndrewK.,This is the movie that everybody argues is better than Scarface? Scarface blows this dumbass movie to hell. This is a true borefest.,,,,,,,,,,,,,,,,,,,,,,,,,,,,,,,,,,,,,,,,,,,
User,5,10,FALSE,10,Moviebuffreview,An excellent adapted script, an unforgettable ensemble, an amazing score, excellent quotes, and unforgettable moments, The Godfather is nothing short of a masterpiece!,,,,,,,,,,,,,,,,,,,,,,,,,,,,,,,,,,,,,,
User,4,8,TRUE,0,steventrouble,This is the only movie I've ever watched that has put me to sleep. I imagine that the entire movie could have been put into about 1/8th the time and still have retained all of its meaning.,,,,,,,,,,,,,,,,,,,,,,,,,,,,,,,,,,,,,,,,,,,
User,2,4,FALSE,3,JoeF,Masterpiece of $&!%. The ratio of 10 ratings is a excellent example of how dependent peoples minds are on the status quo. If you were to watch this movie without ever hearing about it you would most likely find it to be a well scripted dull Masterpiece of $&!%. The ratio of 10 ratings is a excellent example of how dependent peoples minds are on the status quo. If you were to watch this movie without ever hearing about it you would most likely find it to be a well scripted dull movie and nothing more.,,,,,,,,,,,,,,,,,,,,,,,,,,,,,,,,,,,,,,,,,,,
User,1,2,FALSE,0,ZachS.,Wow. That's all I have to say, this film was just horribly overrated.... I mean it's not a bad film or anything, but it is too boring and none of the characters are really likable.,,,,,,,,,,,,,,,,,,,,,,,,,,,,,,,,,,,,,,,,,
User,3,6,TRUE,0,RyanJ.,"I don't know where all of you get off. ""Oh I like The Godfather.. you know", and The Beatles, and bread, and water," and breathing"" please can we get out of the mentality that we have to venerate this movie. Sure. Watch it once. Recall I don't know where all of you get off. ""Oh I like The Godfather.. you know", and The Beatles, and bread, and water," and breathing"" please can we get out of the mentality that we have to venerate this movie. Sure. Watch it once. Recall that the baby boomer generation will revere it until they die off. I say at that point we don't show this movie to kids born in the 21st century. next!",,,,,,,,,,,,,,,,,,,,,,,,,,,,,,,,,,,
User,1,2,FALSE,0,DavidC.,Ok if by 100 you mean its worth seeing if you get paid $100 dollars but I would not even see it again for that much worse time of my life and the only reason i didn't leave is because it was raining out side. This movie was the worse I Ok if by 100 you mean its worth seeing if you get paid $100 dollars but I would not even see it again for that much worse time of my life and the only reason i didn't leave is because it was raining out side. This movie was the worse I hope critics get shot for saying other wise.,,,,,,,,,,,,,,,,,,,,,,,,,,,,,,,,,,,,,,,,,,,
User,4,8,TRUE,4,ShawnM.,Mumbling Brando is what he should be called. I just didn't see what the big deal was about. I like period movies, dramas, etc., so I thought I would love this film. It left me completely unmoved. Which made it even more confusing - why Mumbling Brando is what he should be called. I just didn't see what the big deal was about. I like period movies, dramas, etc., so I thought I would love this film. It left me completely unmoved. Which made it even more confusing - why the raving critical praise? So I rated it below grade because I felt my time was robbed from me. I've seen better crime films and dramas.,,,,,,,,,,,,,,,,,,,,,,,,,,,,,,,,,,,,,
User,5,10,TRUE,5,BobN,Godfather is NOT the best film ever made (waiting for the plague.) Highly over praised. It is exactly like Apocolypse Now- has moments of greatness- but holy crap is it boring. Brando is commical. Pacino is Pacino starring as Pacino in the Godfather is NOT the best film ever made (waiting for the plague.) Highly over praised. It is exactly like Apocolypse Now- has moments of greatness- but holy crap is it boring. Brando is commical. Pacino is Pacino starring as Pacino in the role of Pacino. I think people love this film soley due to the title: Godfather. Imgaine if the film was called: Second Cousin, or Younger Sister. Nope, had to go with God. Anyways, yeah, this movie...it's an overbloated corpse floating in an L.A. drain pipe...interesting to look at but not for too long.,,,,,,,,,,,,,,,,,,,,,,,,,,,,,,,,,,,,,,,
User,1,2,FALSE,1,JimBobJones,The most overrated and boring thing i have ever seen. It was just a bunch of stuff that happened for three hours. No point, no meaning, no feeling. Get off the bandwaggon!,,,,,,,,,,,,,,,,,,,,,,,,,,,,,,,,,,,,,,,,,
User,2,4,TRUE,0,OverRated,Completely over rated ... nuff said.,,,,,,,,,,,,,,,,,,,,,,,,,,,,,,,,,,,,,,,,,,,
